<?xml version="1.0" encoding="UTF-8"?>
<xs:schema xmlns:xs="http://www.w3.org/2001/XMLSchema" elementFormDefault="qualified">

    <xs:element name="posts">
        <xs:complexType>
            <xs:sequence>
                <xs:element name="post" maxOccurs="unbounded">
                    <xs:complexType>
                        <xs:sequence>
                            <xs:element name="utente" type="xs:string"/>
                            <xs:element name="timestamp" type="xs:dateTime"/>
                            <xs:element name="contenuto">
                                <xs:simpleType>
                                    <xs:restriction base="xs:string">
                                        <xs:maxLength value="280"/>
                                    </xs:restriction>
                                </xs:simpleType>
                            </xs:element>

                            <xs:element name="commenti" minOccurs="0">
                                <xs:complexType>
                                    <xs:sequence>
                                        <xs:element name="commento" maxOccurs="unbounded">
                                            <xs:complexType>
                                                <xs:sequence>
                                                    <xs:element name="utente" type="xs:string"/>
                                                    <xs:element name="timestamp" type="xs:dateTime"/>
                                                    <xs:element name="commentText">
                                                        <xs:simpleType>
                                                            <xs:restriction base="xs:string">
                                                                <xs:maxLength value="120"/>
                                                            </xs:restriction>
                                                        </xs:simpleType>
                                                    </xs:element>
                                                </xs:sequence>
                                                <xs:attribute name="id" type="xs:int" use="required"/>
                                            </xs:complexType>
                                        </xs:element>
                                    </xs:sequence>
                                </xs:complexType>
                            </xs:element>
                        </xs:sequence>
                        <xs:attribute name="id" type="xs:int" use="required"/>
                    </xs:complexType>
                </xs:element>
            </xs:sequence>
        </xs:complexType>
    </xs:element>
</xs:schema>
